<?xml version="1.0" encoding="UTF-8"?>
<list xmlns:xsi="http://www.w3.org/2001/XMLSchema-instance" xsi:noNamespaceSchemaLocation="../../../xsd/clanHall.xsd">
	<clanHall id="56" name="Luna Chamber" grade="GRADE_S" type="AUCTIONABLE">
		<auction minBid="200000000" lease="50000000" deposit="55000000" />
		<npcs>
			<npc id="35577" /> <!-- Harry -->
			<npc id="35576" /> <!-- Jack -->
		</npcs>
		<doorlist>
			<door id="21160011" />
			<door id="21160012" />
		</doorlist>
		<ownerRestartPoint x="38712" y="-46042" z="950" />
		<banishPoint x="43858" y="-48126" z="-792" />
	</clanHall>
</list>